{
  "control_id": "ctl.cui.boundary.asset-inventory",
  "as_of": "2026-08-19T00:00:00Z",
  "population_definition": "All assets attached to the CUI enclave - hosts, storage buckets, databases, SaaS tenants and managed endpoints - reconciled against the authoritative network ranges and the enclave cloud account list.",
  "source_system": "enclave CMDB reconciled against AWS GovCloud Config and enclave MDM",
  "query_ref": "models/controls/ctl_cui_boundary_asset_inventory.sql",
  "total": 412,
  "passing_count": 405,
  "failing_count": 7,
  "failing": [
    {
      "subject_id": "i-0c41ab77de92",
      "reason": "unmanaged_asset_absent_from_cmdb",
      "first_observed": "2026-08-11T00:00:00Z",
      "variance": {
        "variance_started_at": "2026-08-10T14:22:00Z",
        "variance_detected_at": "2026-08-11T00:00:00Z",
        "remediation_started_at": "2026-08-12T09:15:00Z",
        "remediation_completed_at": null,
        "started_at_basis": "source_system"
      }
    },
    {
      "subject_id": "i-0f9928bb1042",
      "reason": "unmanaged_asset_absent_from_cmdb",
      "first_observed": "2026-08-14T00:00:00Z",
      "variance": {
        "variance_started_at": "2026-08-13T18:40:00Z",
        "variance_detected_at": "2026-08-14T00:00:00Z",
        "remediation_started_at": null,
        "remediation_completed_at": null,
        "started_at_basis": "source_system"
      }
    },
    {
      "subject_id": "s3://enclave-artifacts-7731",
      "reason": "no_classification_recorded",
      "first_observed": "2026-07-29T00:00:00Z",
      "variance": {
        "variance_started_at": null,
        "variance_detected_at": "2026-07-29T00:00:00Z",
        "remediation_started_at": null,
        "remediation_completed_at": null,
        "started_at_basis": "equals_detected"
      }
    },
    {
      "subject_id": "s3://enclave-scratch-0042",
      "reason": "no_classification_recorded",
      "first_observed": "2026-07-29T00:00:00Z",
      "variance": {
        "variance_started_at": null,
        "variance_detected_at": "2026-07-29T00:00:00Z",
        "remediation_started_at": null,
        "remediation_completed_at": null,
        "started_at_basis": "equals_detected"
      }
    },
    {
      "subject_id": "db-enclave-reporting-02",
      "reason": "no_owner_recorded",
      "first_observed": "2026-08-05T00:00:00Z",
      "variance": {
        "variance_started_at": "2026-08-04T11:02:00Z",
        "variance_detected_at": "2026-08-05T00:00:00Z",
        "remediation_started_at": "2026-08-06T08:00:00Z",
        "remediation_completed_at": null,
        "started_at_basis": "source_system"
      }
    },
    {
      "subject_id": "MDM-DEV-41188",
      "reason": "no_owner_recorded",
      "first_observed": "2026-08-18T00:00:00Z",
      "variance": {
        "variance_started_at": "2026-08-17T16:31:00Z",
        "variance_detected_at": "2026-08-18T00:00:00Z",
        "remediation_started_at": null,
        "remediation_completed_at": null,
        "started_at_basis": "source_system"
      }
    },
    {
      "subject_id": "MDM-DEV-41203",
      "reason": "no_owner_recorded",
      "first_observed": "2026-08-18T00:00:00Z",
      "variance": {
        "variance_started_at": "2026-08-17T16:31:00Z",
        "variance_detected_at": "2026-08-18T00:00:00Z",
        "remediation_started_at": null,
        "remediation_completed_at": null,
        "started_at_basis": "source_system"
      }
    }
  ],
  "passing": null,
  "coverage_basis": "412 of 412 enclave assets in scope; no documented exceptions. Denominator moved +6 from the 2026-08-12 snapshot (406), which is itself under investigation - a moving denominator on this control is a finding about the inventory, not noise.",
  "confidence_tier": 4,
  "fixture": true
}
