{
  "control_id": "ctl.iam.cui-enclave.mfa",
  "as_of": "2026-08-19T00:00:00Z",
  "population_definition": "All human identities in the CUI enclave identity provider with status active, excluding service principals and excluding break-glass accounts.",
  "source_system": "enclave IdP (Okta or Entra ID, enclave tenant)",
  "query_ref": "models/controls/ctl_iam_cui_enclave_mfa.sql",
  "total": 128,
  "passing_count": 124,
  "failing_count": 4,
  "failing": [
    {
      "subject_id": "u_8831",
      "reason": "no_factor_enrolled",
      "first_observed": "2026-08-02T00:00:00Z",
      "variance": {
        "variance_started_at": "2026-08-01T09:12:00Z",
        "variance_detected_at": "2026-08-02T00:00:00Z",
        "remediation_started_at": "2026-08-04T13:40:00Z",
        "remediation_completed_at": null,
        "started_at_basis": "source_system"
      }
    },
    {
      "subject_id": "u_9014",
      "reason": "no_phishing_resistant_factor",
      "first_observed": "2026-06-30T00:00:00Z",
      "variance": {
        "variance_started_at": "2026-06-29T15:05:00Z",
        "variance_detected_at": "2026-06-30T00:00:00Z",
        "remediation_started_at": "2026-07-14T10:00:00Z",
        "remediation_completed_at": null,
        "started_at_basis": "source_system"
      }
    },
    {
      "subject_id": "u_9077",
      "reason": "no_phishing_resistant_factor",
      "first_observed": "2026-06-30T00:00:00Z",
      "variance": {
        "variance_started_at": "2026-06-29T15:05:00Z",
        "variance_detected_at": "2026-06-30T00:00:00Z",
        "remediation_started_at": "2026-07-14T10:00:00Z",
        "remediation_completed_at": null,
        "started_at_basis": "source_system"
      }
    },
    {
      "subject_id": "u_9310",
      "reason": "authentication_policy_exemption_active",
      "first_observed": "2026-08-15T00:00:00Z",
      "variance": {
        "variance_started_at": "2026-08-15T07:44:00Z",
        "variance_detected_at": "2026-08-15T00:00:00Z",
        "remediation_started_at": null,
        "remediation_completed_at": null,
        "started_at_basis": "source_system"
      }
    }
  ],
  "passing": null,
  "coverage_basis": "128 of 131 active human enclave identities in scope; 3 break-glass accounts excluded, carried by a separate control with compensating session monitoring. The exclusion reduces coverage rather than leaving the denominator - EX-0041, expires 2026-12-31.",
  "confidence_tier": 4,
  "fixture": true
}
